{
  "schema_version": "1.0.0",
  "metadata": {
    "run_id": "baseline-task8-vf-3",
    "executed_at": "2026-10-03T21:26:07.662465+00:00",
    "plugin_version": "0.7.5",
    "model": "gpt-5.6-sol (CLI default; revision not exposed)",
    "client": "Codex CLI 0.148.0 / exec --ephemeral / readonly / ignore-user-config",
    "session_id": "01a103a8-f8db-7302-9459-50cbbcccf112",
    "round": 3,
    "origin": "captured_session",
    "duration_seconds": 16.722
  },
  "case_snapshot": {
    "id": "task8-vf",
    "skill": "estudar-direito-magistratura",
    "prompt": "Política acervo_exclusivo; cliente textual sem MCP.\n\nCrie uma questão objetiva inédita de alta complexidade, formato V/F, com três assertivas e cinco sequências A–E, sem solução antecipada. Preserve exclusivamente o núcleo do material novo.\n\nMaterial legível enviado nesta mensagem:\n# Material didático novo — competência e efeitos da decisão\n\nSíntese autoral para validação, sem dados pessoais. Base: CPC, art. 64, §§ 2º–4º, conferido no Planalto em 2026-10-03.\nApós ouvir a parte adversa, o magistrado resolve imediatamente a arguição de incompetência. Se a acolher, encaminha o processo ao juízo competente.\nA incompetência reconhecida não extingue automaticamente os efeitos da decisão anterior: eles permanecem, ressalvada determinação judicial contrária, até eventual nova decisão do órgão competente.\nÉ necessário distinguir o destino dos autos da eficácia da decisão. O encaminhamento decorre do acolhimento; a perda da eficácia depende da ressalva judicial ou da substituição, quando cabível. Não se deduz invalidação automática de todos os atos.\n\nFonte oficial: https://www.planalto.gov.br/ccivil_03/_ato2015-2018/2015/lei/l13105.htm (art. 64, §§ 2º–4º).\nNão contém julgados, corpus de prova, classificação de dificuldade ou perfil de desempenho.\n",
    "fixtures": [
      "task8/material.md: síntese autoral conferida no art. 64, §§ 2º–4º, do CPC; sem corpus de prova."
    ],
    "source_policy": "acervo_exclusivo",
    "expected_output": "Atender ao formato e recorte com ancoragem no material; cenário sem corpus preserva limite empírico; correções só depois da tentativa explícita.",
    "assertions": [
      {
        "id": "avaliacao-posterior",
        "description": "Revisão semântica posterior identificada; testes de marcadores não certificam qualidade jurídica.",
        "kind": "human"
      }
    ],
    "human_rubric": [
      "Suporte jurídico e ausência de extrapolação da fonte",
      "Unicidade e distinções funcionais quando houver questão",
      "Plausibilidade e erro singular dos distratores quando houver alternativas",
      "Correção integral após acerto/erro, quando houver tentativa",
      "Ancoragem no material legível novo",
      "Ausência de solução antes da tentativa; ressalva empírica sem corpus"
    ],
    "risk_tags": [
      "ancoragem",
      "vazamento-gabarito",
      "sem-corpus-empirico"
    ]
  },
  "case_sha256": "063f5b3f7e1a26a8dfd611ebef21dc22570a49afafc80241443fdba8be5dc3a9",
  "output": "Em ação submetida ao procedimento comum, o réu arguiu incompetência na contestação. Antes de apreciar a alegação, o magistrado ouviu o autor. Ao acolhê-la, determinou a remessa dos autos ao juízo competente, mas nada dispôs expressamente sobre os efeitos de tutela provisória anteriormente concedida.\n\nÀ luz do art. 64, §§ 2º a 4º, do CPC, examine as assertivas:\n\nI. O magistrado deve decidir imediatamente a alegação após ouvir a parte contrária e, caso reconheça a incompetência, determinar a remessa dos autos ao juízo competente.\n\nII. O acolhimento da incompetência acarreta, por si só, a cessação imediata dos efeitos da tutela provisória anteriormente concedida, cabendo ao juízo competente restaurá-los mediante nova decisão.\n\nIII. A remessa dos autos e a eficácia da decisão anterior submetem-se a regimes distintos: no silêncio do magistrado que reconheceu a incompetência, os efeitos da tutela permanecem até que outra decisão seja proferida, se for o caso, pelo juízo competente.\n\nAssinale a sequência correta:\n\nA) V – V – F  \nB) V – F – V  \nC) F – V – V  \nD) V – F – F  \nE) F – F – V",
  "output_sha256": "d20399eea0eb182bbcdf0eaa304322f9c7756957e4b2b4dd78e25b6144b3de05",
  "evaluation": {
    "case_id": "task8-vf",
    "status": "revisao_humana_pendente",
    "assertions": [],
    "human_review_required": [
      "rubrica-1",
      "rubrica-2",
      "rubrica-3",
      "rubrica-4",
      "rubrica-5",
      "rubrica-6",
      "avaliacao-posterior"
    ]
  }
}
