{
  "schema_version": "1.0.0",
  "metadata": {
    "run_id": "baseline-task8-associacao-2",
    "executed_at": "2026-10-03T21:26:29.042716+00:00",
    "plugin_version": "0.7.5",
    "model": "gpt-5.6-sol (CLI default; revision not exposed)",
    "client": "Codex CLI 0.148.0 / exec --ephemeral / readonly / ignore-user-config",
    "session_id": "01a103a9-4c37-70d2-8629-1b9e86234d9d",
    "round": 2,
    "origin": "captured_session",
    "duration_seconds": 22.136
  },
  "case_snapshot": {
    "id": "task8-associacao",
    "skill": "estudar-direito-magistratura",
    "prompt": "Política acervo_exclusivo; cliente textual sem MCP.\n\nCrie uma questão objetiva inédita de alta complexidade, formato associação entre três situações e suas consequências, com cinco combinações A–E, sem solução antecipada. Preserve exclusivamente o núcleo do material novo.\n\nMaterial legível enviado nesta mensagem:\n# Material didático novo — competência e efeitos da decisão\n\nSíntese autoral para validação, sem dados pessoais. Base: CPC, art. 64, §§ 2º–4º, conferido no Planalto em 2026-10-03.\nApós ouvir a parte adversa, o magistrado resolve imediatamente a arguição de incompetência. Se a acolher, encaminha o processo ao juízo competente.\nA incompetência reconhecida não extingue automaticamente os efeitos da decisão anterior: eles permanecem, ressalvada determinação judicial contrária, até eventual nova decisão do órgão competente.\nÉ necessário distinguir o destino dos autos da eficácia da decisão. O encaminhamento decorre do acolhimento; a perda da eficácia depende da ressalva judicial ou da substituição, quando cabível. Não se deduz invalidação automática de todos os atos.\n\nFonte oficial: https://www.planalto.gov.br/ccivil_03/_ato2015-2018/2015/lei/l13105.htm (art. 64, §§ 2º–4º).\nNão contém julgados, corpus de prova, classificação de dificuldade ou perfil de desempenho.\n",
    "fixtures": [
      "task8/material.md: síntese autoral conferida no art. 64, §§ 2º–4º, do CPC; sem corpus de prova."
    ],
    "source_policy": "acervo_exclusivo",
    "expected_output": "Atender ao formato e recorte com ancoragem no material; cenário sem corpus preserva limite empírico; correções só depois da tentativa explícita.",
    "assertions": [
      {
        "id": "avaliacao-posterior",
        "description": "Revisão semântica posterior identificada; testes de marcadores não certificam qualidade jurídica.",
        "kind": "human"
      }
    ],
    "human_rubric": [
      "Suporte jurídico e ausência de extrapolação da fonte",
      "Unicidade e distinções funcionais quando houver questão",
      "Plausibilidade e erro singular dos distratores quando houver alternativas",
      "Correção integral após acerto/erro, quando houver tentativa",
      "Ancoragem no material legível novo",
      "Ausência de solução antes da tentativa; ressalva empírica sem corpus"
    ],
    "risk_tags": [
      "ancoragem",
      "vazamento-gabarito",
      "sem-corpus-empirico"
    ]
  },
  "case_sha256": "70ddd002ef13b68c2dc340834c90508d117c89027a401aa9b150eadc26756cf3",
  "output": "Em três processos distintos, a parte ré arguiu a incompetência do juízo. Em todos, a parte adversa foi previamente ouvida:\n\n1. No primeiro processo, o magistrado rejeitou a arguição, sem proferir qualquer determinação sobre os efeitos das decisões anteriormente praticadas.\n\n2. No segundo, acolheu a arguição e determinou o encaminhamento dos autos ao juízo competente, mas silenciou quanto à tutela provisória anteriormente concedida.\n\n3. No terceiro, acolheu a arguição, determinou o encaminhamento dos autos e declarou expressamente que uma decisão anteriormente proferida deixaria de produzir efeitos.\n\nAssocie cada situação à consequência juridicamente adequada:\n\nI. O processo deve ser encaminhado ao juízo competente, e a decisão anterior conserva seus efeitos até que seja eventualmente substituída por decisão do órgão competente.\n\nII. O processo deve ser encaminhado ao juízo competente, mas a decisão anterior perde sua eficácia em razão de determinação judicial expressa, e não como consequência automática do reconhecimento da incompetência.\n\nIII. A arguição deve ser imediatamente resolvida, mas sua rejeição não produz o encaminhamento dos autos nem permite concluir, por si só, pela invalidação automática dos atos anteriores.\n\nA associação correta é:\n\nA) 1–I; 2–III; 3–II.\n\nB) 1–II; 2–I; 3–III.\n\nC) 1–III; 2–II; 3–I.\n\nD) 1–III; 2–I; 3–II.\n\nE) 1–II; 2–III; 3–I.",
  "output_sha256": "c873a6daf28be7f25ebbd92511976c37106fba663aa52325a3066cf12a737199",
  "evaluation": {
    "case_id": "task8-associacao",
    "status": "revisao_humana_pendente",
    "assertions": [],
    "human_review_required": [
      "rubrica-1",
      "rubrica-2",
      "rubrica-3",
      "rubrica-4",
      "rubrica-5",
      "rubrica-6",
      "avaliacao-posterior"
    ]
  }
}
