{
  "schema_version": "1.0.0",
  "metadata": {
    "run_id": "baseline-release08-associacao-reutilizacao-2",
    "executed_at": "2026-10-03T22:23:55.923357+00:00",
    "plugin_version": "0.7.5",
    "model": "gpt-5.6-sol (default, internal revision not exposed)",
    "client": "Codex CLI 0.148.0 / ephemeral / readonly / ignore-user-config",
    "session_id": "01a103dd-872f-7e31-b03f-3629ac2b04c1",
    "round": 2,
    "origin": "captured_session"
  },
  "case_snapshot": {
    "id": "release08-associacao-reutilizacao",
    "skill": "estudar-direito-magistratura",
    "prompt": "Modo acervo_exclusivo. Transforme o material abaixo em uma questão difícil de associação de colunas, com cinco alternativas.\n\n# Material didático novo — competência e efeitos da decisão\n\nSíntese autoral para validação, sem dados pessoais. Base: CPC, art. 64, §§ 2º–4º, conferido no Planalto em 2026-10-03.\nApós ouvir a parte adversa, o magistrado resolve imediatamente a arguição de incompetência. Se a acolher, encaminha o processo ao juízo competente.\nA incompetência reconhecida não extingue automaticamente os efeitos da decisão anterior: eles permanecem, ressalvada determinação judicial contrária, até eventual nova decisão do órgão competente.\nÉ necessário distinguir o destino dos autos da eficácia da decisão. O encaminhamento decorre do acolhimento; a perda da eficácia depende da ressalva judicial ou da substituição, quando cabível. Não se deduz invalidação automática de todos os atos.\n\nFonte oficial: https://www.planalto.gov.br/ccivil_03/_ato2015-2018/2015/lei/l13105.htm (art. 64, §§ 2º–4º).\nNão contém julgados, corpus de prova, classificação de dificuldade ou perfil de desempenho.\n",
    "fixtures": [
      "task8/material.md: síntese autoral conferida no CPC, art. 64, §§2º–4º."
    ],
    "source_policy": "acervo_exclusivo",
    "expected_output": "Associação com regra pública de reutilização compatível com os vínculos e combinações.",
    "assertions": [
      {
        "id": "avaliacao-posterior",
        "description": "Revisão semântica posterior identificada; testes de marcadores não certificam qualidade jurídica.",
        "kind": "human"
      }
    ],
    "human_rubric": [
      "Ausência de fundamento determinante exposto antes da tentativa",
      "Regra de reutilização visível quando aplicável",
      "Unicidade e suporte jurídico; revisão humana necessária"
    ],
    "risk_tags": [
      "ancoragem",
      "vazamento-gabarito",
      "sem-corpus-empirico"
    ]
  },
  "case_sha256": "6cd21bff6b9d3d08deb3df2bf2c0d2c072731c491e4e569941f4020b3166f5cb",
  "output": "Em quatro processos, a incompetência do juízo foi arguida, com diferentes estágios procedimentais e efeitos sobre decisões anteriormente proferidas. Considerando exclusivamente o art. 64, §§ 2º a 4º, do CPC, associe cada situação da Coluna I à consequência jurídica correspondente da Coluna II. Cada consequência deve ser utilizada uma única vez.\n\n**Coluna I**\n\n1. A incompetência foi arguida, mas a parte adversa ainda não teve oportunidade de se manifestar.  \n2. Após a manifestação da parte adversa, o magistrado rejeitou a arguição de incompetência.  \n3. Após o contraditório, a incompetência foi acolhida, sem pronunciamento contrário à eficácia de decisão anteriormente proferida pelo juízo incompetente.  \n4. Após o contraditório, a incompetência foi acolhida, e o magistrado determinou expressamente que a decisão anteriormente proferida não conservasse seus efeitos.\n\n**Coluna II**\n\nI. Os autos devem ser remetidos ao juízo competente, e a decisão anterior não conserva seus efeitos em razão da determinação judicial expressa, sem que disso decorra invalidação automática de todos os atos processuais.  \nII. A arguição ainda não deve ser resolvida, pois a decisão imediata pressupõe a prévia oitiva da parte adversa.  \nIII. Os autos devem ser remetidos ao juízo competente, mas a decisão anterior conserva seus efeitos até que outra seja proferida, se for o caso, pelo órgão competente.  \nIV. O processo permanece no juízo em que tramita, pois a remessa prevista no art. 64 decorre do acolhimento da incompetência, sem que a mera arguição determine o encaminhamento dos autos.\n\nAssinale a alternativa que apresenta a associação correta.\n\nA) 1–II; 2–IV; 3–III; 4–I.  \nB) 1–II; 2–III; 3–IV; 4–I.  \nC) 1–IV; 2–II; 3–I; 4–III.  \nD) 1–III; 2–IV; 3–I; 4–II.  \nE) 1–IV; 2–I; 3–III; 4–II.",
  "output_sha256": "658fd344073c7810f56b847b4c4950a8a666ec3fd6c8bc0112b4a99f849a4d2b",
  "evaluation": {
    "case_id": "release08-associacao-reutilizacao",
    "status": "revisao_humana_pendente",
    "assertions": [],
    "human_review_required": [
      "rubrica-1",
      "rubrica-2",
      "rubrica-3",
      "avaliacao-posterior"
    ]
  }
}
